{
  "schemaVersion": "0.1",
  "title": "订单后处理从同步链路改为 Kafka 异步消费",
  "summary": "订单主事务只负责落库与可靠发布事件，积分和通知移出同步请求，通过 Kafka 消费、幂等、重试与死信机制降低主链路耦合。",
  "meta": { "status": "draft", "version": "v1", "scope": "Order Post-processing", "confidence": "medium" },
  "scoping": {
    "fullDesignRequired": true,
    "pressure": "high",
    "reasons": ["同步调用改为消息边界，系统拓扑发生变化", "新增至少一次投递、幂等、重试和补偿问题", "上线需要双路灰度和可回滚策略"],
    "dimensions": {
      "changeScope": "high", "dataChange": "medium", "callChain": "high",
      "businessRisk": "high", "performanceCapacity": "medium", "technicalUncertainty": "medium"
    }
  },
  "evidence": {
    "facts": [
      { "id": "fact-sync-postprocess", "text": "订单创建后的积分与通知当前位于同步请求链路。", "source": "示例现状" },
      { "id": "fact-latency-goal", "text": "目标是让后处理故障不再直接拉长订单接口耗时。", "source": "示例目标" }
    ],
    "assumptions": [
      { "id": "assumption-at-least-once", "text": "订单事件允许至少一次投递，消费者通过业务幂等实现最终单次效果。", "source": "方案假设", "material": true }
    ],
    "unknowns": [
      { "id": "unknown-kafka-capacity", "text": "现有 Kafka 集群的分区容量、保留策略和告警阈值需要在上线前核实。", "source": "Research Gate", "material": true }
    ]
  },
  "blocks": [
    {"id":"context","type":"context","title":"现状问题","importance":"high","reason":"需要解释为什么要改变同步边界，而不是单纯为了使用 Kafka。","sourceRefs":["fact-sync-postprocess","fact-latency-goal"],"representation":{"kind":"text","engine":"native","reason":"问题陈述本身不需要图。"},"content":{"body":"订单接口当前在主请求内串行执行积分和通知。任一后处理抖动都会扩大订单接口延迟和失败面。"}},
    {"id":"goals","type":"goals","title":"目标与边界","importance":"high","reason":"异步化会改变完成语义，必须先明确什么必须同步成功、什么允许最终完成。","representation":{"kind":"cards","engine":"native","reason":"三类边界并列展示更清楚。"},"content":{"cards":[{"tag":"Sync","title":"订单主事务","body":"订单落库成功是接口成功的核心条件。"},{"tag":"Async","title":"积分与通知","body":"允许在订单成功后异步完成，并可重试。"},{"tag":"Non-goal","title":"不改支付链路","body":"本次不把支付确认或资金动作迁入异步后处理。"}] }},
    {"id":"architecture","type":"architecture","title":"目标架构","importance":"high","reason":"同步边界变成消息边界，组件关系和故障隔离方式是本次设计的核心变化。","sourceRefs":["assumption-at-least-once"],"representation":{"kind":"architecture","engine":"archify","reason":"多服务、消息总线和存储之间的边界用架构图比文字更直观。","spec":{"schema_version":1,"diagram_type":"architecture","meta":{"title":"订单异步后处理目标架构","locale":"zh-CN","quality_profile":"showcase"},"layout":{"mode":"grid","cols":5,"gapX":40,"gapY":40,"cellW":180,"cellH":100},"components":[{"id":"client","type":"frontend","label":"调用方","row":0,"col":0},{"id":"order","type":"backend","label":"订单服务","sublabel":"主事务 + Outbox","row":0,"col":1},{"id":"db","type":"database","label":"订单数据库","row":1,"col":1},{"id":"kafka","type":"messagebus","label":"Kafka","sublabel":"order-created","row":0,"col":2},{"id":"points","type":"backend","label":"积分消费者","row":0,"col":3},{"id":"notify","type":"backend","label":"通知消费者","row":1,"col":3},{"id":"dlq","type":"messagebus","label":"失败事件 / DLQ","row":1,"col":4}],"connections":[{"from":"client","to":"order","label":"创建订单"},{"from":"order","to":"db","label":"订单 + Outbox 同事务"},{"from":"order","to":"kafka","label":"可靠发布"},{"from":"kafka","to":"points","label":"至少一次消费"},{"from":"kafka","to":"notify","label":"至少一次消费"},{"from":"points","to":"dlq","label":"超限失败"},{"from":"notify","to":"dlq","label":"超限失败"}]}},"content":{"body":"主请求只承担订单事务；后处理通过事件解耦。"}},
    {"id":"flow","type":"flow","title":"订单创建时序","importance":"high","reason":"事务提交、事件发布、ACK 与异步消费的先后顺序直接影响丢消息和重复消费风险。","representation":{"kind":"sequence","engine":"archify","reason":"正确性依赖参与者之间的时间顺序，Sequence 是最小清晰表达。","spec":{"schema_version":1,"diagram_type":"sequence","meta":{"title":"订单创建与异步后处理","locale":"zh-CN","quality_profile":"showcase","column_fit":"spread"},"participants":[{"id":"client","type":"frontend","label":"调用方"},{"id":"order","type":"backend","label":"订单服务"},{"id":"db","type":"database","label":"订单数据库"},{"id":"kafka","type":"messagebus","label":"Kafka"},{"id":"consumer","type":"backend","label":"后处理消费者"}],"messages":[{"from":"client","to":"order","y":180,"label":"createOrder"},{"from":"order","to":"db","y":240,"label":"订单 + Outbox 同事务提交","variant":"emphasis"},{"from":"order","to":"client","y":300,"label":"订单创建成功","variant":"return"},{"from":"order","to":"kafka","y":370,"label":"发布 order-created"},{"from":"kafka","to":"consumer","y":440,"label":"投递事件"},{"from":"consumer","to":"consumer","y":510,"label":"幂等检查并执行后处理"},{"from":"consumer","to":"kafka","y":580,"label":"成功后提交消费位点","variant":"return"}]}},"content":{"body":"Outbox 与订单同事务，消费者在业务效果成功后再确认消费进度。"}},
    {"id":"interfaces","type":"interfaces","title":"事件契约","importance":"high","reason":"跨服务异步边界必须稳定定义事件身份、业务键和兼容字段。","representation":{"kind":"table","engine":"native","reason":"消息字段适合逐项核对。"},"content":{"columns":[{"key":"field","label":"字段"},{"key":"purpose","label":"用途"},{"key":"rule","label":"规则"}],"rows":[{"field":"eventId","purpose":"幂等键","rule":"全局唯一，重投保持不变"},{"field":"orderId","purpose":"业务聚合键","rule":"用于分区和业务关联"},{"field":"eventType","purpose":"契约类型","rule":"order.created"},{"field":"occurredAt","purpose":"业务发生时间","rule":"ISO-8601"},{"field":"payload","purpose":"后处理最小所需数据","rule":"只放稳定必要字段，新增字段向后兼容"}]}},
    {"id":"data","type":"data","title":"可靠性与幂等数据","importance":"high","reason":"异步化新增 Outbox、消费幂等和失败留痕，这些数据决定是否会丢或重复业务效果。","sourceRefs":["assumption-at-least-once"],"representation":{"kind":"table","engine":"native","reason":"多个持久化职责需要明确事实源和生命周期。"},"content":{"columns":[{"key":"store","label":"数据"},{"key":"role","label":"职责"},{"key":"lifecycle","label":"生命周期"}],"rows":[{"store":"order_outbox","role":"与订单同事务记录待发布事件","lifecycle":"发布确认后保留短期审计再清理"},{"store":"consumer_dedup","role":"按 eventId 防重复业务效果","lifecycle":"覆盖最大重放窗口"},{"store":"failure record / DLQ","role":"保存超限失败用于人工或自动重放","lifecycle":"按运维策略保留"}]}},
    {"id":"decision","type":"decisions","title":"关键技术决策","importance":"high","reason":"直接双写与事务 Outbox 都看似可行，但在丢消息风险和复杂度上存在真实取舍。","representation":{"kind":"table","engine":"native","reason":"两个真实候选需要直接对比关键轴。"},"content":{"columns":[{"key":"option","label":"方案"},{"key":"correctness","label":"正确性"},{"key":"cost","label":"复杂度"},{"key":"outcome","label":"结论"}],"rows":[{"option":"应用先写 DB 再发 Kafka","correctness":"存在 DB 成功但发消息失败的双写窗口","cost":"低","outcome":"拒绝"},{"option":"Transactional Outbox","correctness":"订单和待发布事件同事务，发布可重试","cost":"中","outcome":"采用"}],"options":["直接双写","Transactional Outbox"]}},
    {"id":"nfr","type":"non_functional","title":"非功能约束","importance":"high","reason":"异步系统是否可运营取决于延迟、积压、重试和可观测性边界。","representation":{"kind":"cards","engine":"native","reason":"四个独立约束适合并列扫描。"},"content":{"cards":[{"title":"交付语义","body":"至少一次投递 + 业务幂等，不宣称 exactly-once。"},{"title":"顺序","body":"按 orderId 分区，仅保证同订单事件顺序。"},{"title":"重试","body":"指数退避；达到上限进入失败事件/DLQ。"},{"title":"可观测性","body":"监控发布延迟、consumer lag、重试率、DLQ 数量和处理耗时。"}]}},
    {"id":"rollout","type":"rollout","title":"灰度与回滚","importance":"high","reason":"同步切异步存在行为切换风险，需要保证同一订单不会同时执行两套后处理。","representation":{"kind":"table","engine":"native","reason":"阶段、行为和回退条件需要一一对应。"},"content":{"columns":[{"key":"stage","label":"阶段"},{"key":"behavior","label":"行为"},{"key":"rollback","label":"回退"}],"rows":[{"stage":"影子发布","behavior":"发布事件但消费者只记录不产生业务效果","rollback":"停止发布"},{"stage":"小流量异步","behavior":"按订单稳定分桶，仅一部分订单走异步后处理","rollback":"关闭异步桶，恢复同步"},{"stage":"全量","behavior":"全部后处理由消费者执行","rollback":"保留同步实现开关，确认积压处理策略后回切"}]}},
    {"id":"verification","type":"verification","title":"验证计划","importance":"high","reason":"必须证明不丢、不重、可恢复，而不仅是接口变快。","representation":{"kind":"table","engine":"native","reason":"故障场景与期望行为适合测试矩阵。"},"content":{"columns":[{"key":"scenario","label":"场景"},{"key":"expected","label":"期望"}],"rows":[{"scenario":"DB 提交后发布进程崩溃","expected":"Outbox 后续重试发布，事件不丢"},{"scenario":"同一事件重复投递","expected":"幂等记录阻止重复积分/通知"},{"scenario":"消费者连续失败","expected":"按策略重试后进入 DLQ，主订单不回滚"},{"scenario":"Kafka 短时不可用","expected":"订单仍可提交，Outbox 积压可观测并恢复发布"}]}},
    {"id":"risks","type":"risks","title":"风险与待确认","importance":"high","reason":"容量和运维参数仍有真实未知，必须在上线前显式关闭。","sourceRefs":["unknown-kafka-capacity"],"representation":{"kind":"table","engine":"native","reason":"风险、影响和关闭条件需要可追踪。"},"content":{"columns":[{"key":"risk","label":"风险"},{"key":"impact","label":"影响"},{"key":"close","label":"关闭条件"}],"rows":[{"risk":"Kafka 分区/吞吐不足","impact":"积压扩大，后处理延迟","close":"按峰值事件率压测并确认分区容量"},{"risk":"幂等保留窗口过短","impact":"历史重放产生重复业务效果","close":"保留时间覆盖 Kafka 最大保留与人工重放窗口"},{"risk":"灰度双执行","impact":"积分/通知重复","close":"按订单稳定分桶且同步/异步开关互斥"}]}}
  ]
}
